{
  "$schema": "../../schemas/skill.schema.json",
  "schemaVersion": "1.0.0",
  "build": 399,
  "status": "development",
  "skills": [
    {
      "id": "devTagDrivenInteraction",
      "version": 1,
      "status": "development",
      "name": {"ja": "検証・タグ駆動相互作用", "en": "Dev Tag-Driven Interaction"},
      "kind": "interaction",
      "mpCost": 0,
      "cooldown": 0,
      "target": "enemy",
      "execution": {
        "conditionMode": "all",
        "conditions": [
          {"subject": "target", "type": "has_tag", "tagId": "DEV_INTERACTION_SOURCE"},
          {"subject": "target", "type": "stack_at_least", "stackId": "REFRIGERATION", "amount": 2}
        ],
        "costs": [
          {"subject": "target", "type": "remove_tag", "tagId": "DEV_INTERACTION_SOURCE"},
          {"subject": "target", "type": "consume_stack", "stackId": "REFRIGERATION", "amount": 2}
        ],
        "effects": [
          {"subject": "target", "type": "add_tag", "tag": {"id": "DEV_INTERACTION_RESULT", "name": "検証・相互作用結果"}}
        ]
      }
    }
  ]
}
